{"evidence_id":"CPR-E-EXAMPLE-TITLE","component_id":"CPR-CMP-EXAMPLE-TITLE","evidence_type":"metadata","locator":"chapter.docx:title","access_status":"local","observed_fact":"Title field exists and is linked to current version.","authority":"MWM-CP-EXAMPLE","captured_at":"2026-08-13T00:00:00Z","reviewer":"CPR reviewer","quality_level":"Q2","retention_reference":null}
